{
  "$schema": "https://json-schema.org/draft/2020-12/schema",
  "$id": "https://audit.local/contracts/plugin-runtime-binding.schema.json",
  "title": "PluginRuntimeBinding",
  "description": "已验证 PluginManifest 与 UPP 协议包之间的固定绑定。运行器只接受隔离子进程绑定，不读取命令或入口点。",
  "type": "object",
  "additionalProperties": false,
  "required": ["schema_version", "plugin", "protocol", "execution_mode", "capabilities", "status"],
  "properties": {
    "schema_version": {"type": "string", "pattern": "^(0|[1-9][0-9]*)\\.(0|[1-9][0-9]*)\\.(0|[1-9][0-9]*)$"},
    "plugin": {"$ref": "#/$defs/versioned-package"},
    "protocol": {"$ref": "#/$defs/versioned-package"},
    "execution_mode": {"const": "isolated_subprocess"},
    "capabilities": {"type": "array", "minItems": 1, "uniqueItems": true, "items": {"type": "string", "pattern": "^[a-z][a-z0-9]*(?:[._-][a-z0-9]+)+$"}},
    "status": {"const": "verified"}
  },
  "$defs": {
    "versioned-package": {
      "type": "object",
      "additionalProperties": false,
      "required": ["id", "version", "sha256"],
      "properties": {
        "id": {"type": "string", "pattern": "^[a-z][a-z0-9]*(?:[._-][a-z0-9]+)+$"},
        "version": {"type": "string", "pattern": "^(0|[1-9][0-9]*)\\.(0|[1-9][0-9]*)\\.(0|[1-9][0-9]*)(?:-[0-9A-Za-z.-]+)?(?:\\+[0-9A-Za-z.-]+)?$"},
        "sha256": {"type": "string", "pattern": "^[A-Fa-f0-9]{64}$"}
      }
    }
  }
}
