{
  "schema_version": "1.0.0",
  "plugin": {
    "id": "audit.foundation.viz-analysis",
    "version": "0.1.0",
    "sha256": "e7e7fe4e4b0f0985c56364e8f13d1b0051c5d251cdc872423c82484704e8599f"
  },
  "protocol": {
    "id": "audit.foundation.viz-analysis",
    "version": "0.1.0",
    "sha256": "7cfe19466103b19549249846cda498f9c1cb66ae4a170f2af1f96cb153e22cd1"
  },
  "execution_mode": "isolated_subprocess",
  "capabilities": [
    "audit.foundation.viz-analysis"
  ],
  "status": "verified"
}
