{
  "schema_version": "1.0.0",
  "plugin": {
    "id": "audit.network.skill-output",
    "version": "0.1.0",
    "sha256": "d6fd52b527a68a7b47b5124f57e065c54a0bc00e5a671ebb45a21f24c70960eb"
  },
  "protocol": {
    "id": "audit.network.skill-output",
    "version": "0.1.0",
    "sha256": "573eb1e2cbdf35ac15bd731fd9e63a19a0b88a633e8229e6b3c6cd8cd01a65c9"
  },
  "execution_mode": "isolated_subprocess",
  "capabilities": [
    "audit.network.skill-output"
  ],
  "status": "verified"
}