{
  "schema_version": "1.0.0",
  "plugin": {
    "id": "audit.field.interview-record",
    "version": "0.1.0",
    "sha256": "f8f9ff8c5d5d7ea995b377edb327ef8b491ea8dd089c8c59bddb5dfaef3c0672"
  },
  "protocol": {
    "id": "audit.field.interview-record",
    "version": "0.1.0",
    "sha256": "cd360fddf566141b4934dd7ebd18ce0239d2edbde57d0962fe80a80c24421a9f"
  },
  "execution_mode": "isolated_subprocess",
  "capabilities": [
    "audit.field.interview-record"
  ],
  "status": "verified"
}
